Subreddit,Time,Message_ID,Message_Author,Message_Content,Reply_To,Pragmatic_Inferences,most_salient_inference,inference_type,as_intended,PRE/IMP,aggressive,note
careerguidance,,16l2lqz,quiuo,"""post_title"": WFH: Writing Centric?

""post_content"": Gooooood morning yall,

Does anyone know of any WFH writing careers/job types that pay well from their own personal experience? I'm personally a well fleshed out writer who could produce quality deliverables with a quick turnaround.

I have some college experience (had to drop out due to medical reasons, among others) and I feel that I can craft a resume that can be blasted out online.

I've done some very basic research into copywriting but I was curious if anyone else had advice? Not sure if a degree is necessary in general for this vein of work but I'm curious to find out.

:3",,"{""content"":""The OP does not have a college degree."", ""type"":""representatives""},{""content"":""The OP is new to copywriting."", ""type"":""representatives""},{""content"":""The OP is confident about working as a writer."", ""type"":""expressives""}",The OP is new to copywriting.,representatives,no,IMP,NAG,
careerguidance,9/17/2023 16:52,k0zn2j6,Apprehensive_Win7935,I wouldn’t try to get into a new job if your disabled. No one wants to hire a broken thing.,16l2lqz,"{""content"":""The speaker thinks the OP is not wise in seeking a new job when disabled."", ""type"":""representatives""},{""content"":""The speaker is negative towards people who are disabled."", ""type"":""expressives""}",The speaker thinks the OP is not wise in seeking a new job when disabled.,representatives,no,IMP,OAG,a broken thing
careerguidance,9/17/2023 16:54,k0zndeq,quiuo,"Nah man, I got t-boned by a Tesla while crossing a crosswalk. Flipped over that motherfucker like Patrick Starfish. 

I'm better now, and even if I was disabled, a WFH position would remedy that disingenuous concern you stated.",k0zn2j6,"{""content"":""The OP stresses that he/she was disabled because of an accident, different from other types of disabilities."", ""type"":""representatives""},{""content"":""The OP does not agree that disability would be a concern for WFH jobs."", ""type"":""representatives""}","The OP stresses that he/she was disabled because of an accident, different from other types of disabilities.",representatives,no,IMP,OAG,disingenuous concern
careerguidance,9/17/2023 16:55,k0znga5,Apprehensive_Win7935,Get out of here.  You need to stay off the job market if you are cripple.,k0zndeq,"{""content"":""The speaker thinks that those crippled are not entitled to any jobs."", ""type"":""expressives""}",The speaker thinks that those crippled are not entitled to any jobs.,expressives,no,IMP,OAG,
careerguidance,9/17/2023 16:56,k0znocs,quiuo,"I'm sure I can likely run a faster mile time than you. Sounds to me like you're socially crippled from your attitude. Go out to a bar show and live a little. 

✨️be a star, hoe✨️",k0znga5,"{""content"":""The OP thinks that even if crippled, he/she may be able to run faster than the hearer, refuting the discriminative remarks against the crippled."",""type"":""representatives""},{""content"":""The OP thinks that the hearer's attitude is inappropriate."", ""type"":""expressives""},{""content"":""The OP advises the hearer of improving social skills."", ""type"":""directives""}",The OP advises the hearer of improving social skills.,directives,no,IMP,OAG,
careerguidance,9/17/2023 16:57,k0znv8t,Apprehensive_Win7935,"You can’t even write a coherent response on Reddit, but you want people to pay you to write?",k0znocs,"{""content"":""The speaker accuses the OP of poor writing in the replies, highlighting his/her incompetence for the job as a writer."", ""type"":""expressives""}","The speaker accuses the OP of poor writing in the replies, highlighting his/her incompetence for the job as a writer.",expressives,no,IMP,OAG,
careerguidance,9/17/2023 16:59,k0zo819,quiuo,"It's coherent, you're responding aren't you?

Before you try lame ass insults, just remember that continuing to comment on this thread is going to bump it up so I may get some actual advice.

Gotta love it. 🤍",k0znv8t,"{""content"":""The OP reminds the hearer of the potential benefits for him/her if the hearer continues to post insults."", ""type"":""directives""},{""content"":""The OP thinks that the hearer only wants to insult people and harm their interests, and his/her purpose is not to provide useful advice."", ""type"":""representatives""}","The OP thinks that the hearer only wants to insult people and harm their interests, and his/her purpose is not to provide useful advice.",representatives,no,IMP,OAG,lame ass insults
careerguidance,9/17/2023 17:00,k0zoc62,Apprehensive_Win7935,“Gotta love it” is probably the most faggy thing I’ll read all day.,k0zo819,"{""content"":""The speaker suspects that the OP is a gay."", ""type"":""representatives""},{""content"":""The OP discriminates against gay people."", ""type"":""expressives""}",The speaker suspects that the OP is a gay.,representatives,no,IMP,OAG,Extremely Disparaging and Offensive. of or resembling a gay man
careerguidance,9/17/2023 17:04,k0zoyf2,quiuo,"That's surprising, you haven't analyzed your own responses well enough to realize the absolutely buffoonery of what you've said thus far.

Side note: Fruity people likely have better paying work than you. And if they don't, they're self aware enough to not be an absolutely ✨️cunt✨️like you.

And no, I don't mean that in the British way. ☻️",k0zoc62,"{""content"":""The OP reminds the hearer of how silly his/her comments are."", ""type"":""directives""}, {""content"":""The OP thinks that LGBT people may have better paid jobs and better manners than the hearer, and the hearer's condesending attitude is not justified."", ""type"":""expressives""},{""content"":""The OP shows he/she is aware of the differences between British and American ways of using words and stresses the critical tone in his/her message."", ""type"":""expressives""}",The OP reminds the hearer of how silly his/her comments are,directives,uncertain,IMP,OAG,buffoonery: behaviour that is ridiculous but amusing.
careerguidance,9/17/2023 18:01,k0zy6e4,gnostic357,"They usually want a degree in English.
A listing for a proofreader recently required a Masters “in any discipline”. Good luck. Maybe you’ll find something that isn’t ridiculous.",16l2lqz,"{""content"":""The speaker anticipates that the OP will think the degree requirement for this type of jobs is ridiculous."", ""type"":""expressives""},{""content"":""The speaker hints that even the job of a proofreader requires a master degree."", ""type"":""representatives""},{""content"":""The speaker hints that the competition could be intense because masters in any discipline can apply for the job."", ""type"":""representatives""}",The speaker anticipates that the OP will think the degree requirement for this type of jobs is ridiculous.,expressives,yes,IMP,OAG,
careerguidance,9/17/2023 18:08,k0zzawy,quiuo,Thanks for letting me know (:,k0zy6e4,"{""content"":""The emoticon indicates that the speaker is disappointed to know the information."", ""type"":""expressives""}",The emoticon indicates that the speaker is disappointed to know the information.,expressives,yes,IMP,NAG,
careerguidance,9/17/2023 18:09,k0zzje2,gnostic357,They also often want years of experience and a portfolio of your best work.,k0zzawy,"{""content"":""The speaker warns the OP of even higher requirements for this type of jobs."", ""type"":"" directives""} ",The speaker warns the OP of even higher requirements for this type of jobs.,directives,yes,IMP,NAG,
careerguidance,9/17/2023 18:14,k100b9q,quiuo,"With a growing job market (as it appears to be on paper), I figure the experience aspect can be mitigated by sheer numbers when it comes to job apps. When I was looking into CS when I was getting my CS degree, it looked like one would get 5-10 interviews for every 100-200 apps nowadays. Not sure if that's a reasonable understanding on that side of things but it seems a rough estimate to me.

As for a portfolio, I could delve into my previous writings or create new pieces/examples as needed. Not entirely sure of the details employers are looking for when it comes to this though. Thoughts?",k0zzje2,"{""content"":""Years of experience can be replaced by number of works."", ""type"":""representatives""},{""content"":""The OP had a rough estimate of how many applications he/she should be made to get an interview."", ""type"":""representatives""},{""content"":""The OP has some plans for the portfolio and enquires more details."", ""type"":""directives""}",The OP has some plans for the portfolio and enquires more details.,directives,yes,IMP,NAG,
careerguidance,9/17/2023 18:19,k1015qv,gnostic357,"Only thing to do is start looking for such listings and see what you find. You can set up an Indeed job alert for copywriter, writer, etc., and see what comes up.

I’m an speaker and editor but couldn’t qualify for what I saw. Mainly due to no degree, and no experience as a staff writer.

I’ve also been a reporter, but now I’d need a journalism degree. Being able to do something is apparently irrelevant if you don’t have years of sitting in a classroom on your record.",k100b9q,"{""content"":""The speaker suggests the OP of searching online and finding information by him/her-self."", ""type"":""directives""},{""content"":""The speaker places great importance on degree and experience as qualifications for a job."", ""type"":""representatives""},{""content"":""The speaker thinks that experience is only relevant when one has a degree now."", ""type"":""representatives""}",The speaker thinks that experience is only relevant when one has a degree now.,representatives,no,IMP,NAG,
careerguidance,9/17/2023 18:23,k101q1v,quiuo,Yeah that disregard for practical experience for a piece of paper is a bitch. Let's pray to the eldritch gods that this can be accomplished. (:,k1015qv,"{""content"":""The OP is frustrated when he/she learns that formal education matters while experience is overlooked."", ""type"":""expressives""},{""content"":""The OP shows his/her commitment despite the bias."", ""type"":""commissives""}",The OP is frustrated when he/she learns that formal education matters while experience is overlooked.,expressives,uncertain,IMP,NAG,"is a bitch: A vulgar/slang expression meaning it's frustrating, unfair, or problematic; Eldritch gods: A humorous reference to cosmic or unknowable forces (often from H.P. Lovecraft's fiction), used sarcastically here."
