Subreddit,Time,Message_ID,Message_Author,Message_Content,Reply_To,Pragmatic_Inferences,most_salient_inference,inference_type,as_intended,PRE/IMP,aggressive,note
adultery,,1fbf610,piriform1s,"""post_title"": Dayuse (rather, nightuse) for Intercontinental in London - actually for the whole night?

""post_content"": Wondering if I just inadvertently discovered a great loophole. Intercontinental in London offers a 1700 - 2200 slot for their dayuse. When I checked in, I noticed my registration form actually says I'm checking out the next day and no time is specified. I'm also wondering if they would really send someone to check you out at 10pm when it's the night shift crew and there's no housekeeping to tidy the room anyway, but I didn't stay in the room to find out. Anyone chanced this before and can confirm?",,"{""content"":""It is possible to overrun the check-out deadline of Intercontinental in London."", ""type"":""representatives""},{""content"":""There may be people who made use of this loophole and the OP asks them to supplement more information."", ""type"":""directives""}",It is possible to overrun the check-out deadline of Intercontinental in London.,representatives,no,IMP,NAG,
adultery,9/7/2024 21:44,lm03a8d,Son_of_Riffdog,im confused why you wouldnt just get a room normally then..,1fbf610,"{""content"":""The speaker does not understand why the OP goes the extra mile to confirm this loophole."", ""type"":""expressives""}",The speaker does not understand why the OP goes the extra mile to confirm this loophole.,expressives,no,IMP,NAG,
adultery,9/7/2024 22:18,lm0994f,sayyestothemess123,"I would assume the day use rate is cheaper than a regular nightly rate.

Still, I would be way too nervous and chickenshit to try and stay overnight. I’d be constantly worrying and listening for the pounding on the door telling us to get out 😅. 

But then I’m by nature a rule follower so….maybe just me.",lm03a8d,"{""content"":""People who like to follow rules will find it difficult to enjoy using the loophole."", ""type"":""expressives""},{""content"":""Using the loophole can save money."", ""type"":""representatives""},{""content"":""The speaker is prudent in expressing his/her personal understanding."", ""type"":""representatives""}",People who like to follow rules will find it difficult to enjoy using the loophole.,expressives,no,IMP,NAG,
adultery,9/7/2024 22:22,lm0a180,piriform1s,"You're right, the day rate is 30%+ cheaper. 

But a rule follower, on r/adultery? 🤔",lm0994f,"{""content"":""The OP believes that people under the subreddit adultery are generally cheaters."", ""type"":""expressives""}",The OP believes that people under the subreddit adultery are generally cheaters.,expressives,yes,IMP,CAG,"if the speaker is expressing sarcasm, disbelief, or judgment"
adultery,9/7/2024 22:26,lm0ankz,Son_of_Riffdog,yeah that just feels weird. im not that kind of cheapskate.,lm0994f,"{""content"":""The speaker shares the hearer's expression of awkwardness in using the loophole. "", ""type"":""expressives""}",The speaker shares the hearer's expression of awkwardness in using the loophole.,expressives,yes,IMP,CAG,cheapskate
adultery,9/7/2024 22:27,lm0atw0,sayyestothemess123,"Haha, yep! I even charge myself 5 cents for every paper bag I use at the grocery store when I forget my reusable ones 😭. 

This is my one thing, my one rebellion. Some people take too many ketchup packets. Some take a penny but don’t leave a penny. Some don’t wear seatbelts. Some wear a dress out on the town with the tags still on and then return them. 

Not me. I do this. Apparently. 🤦‍♀️",lm0a180,"{""content"":""The speaker thinks he/she has a side of following rules strictly."", ""type"":""representatives""},{""content"":""The speaker thinks that he/she is not the type of people who would save money by taking advantage of public resources. "", ""type"":""expressives""}",The speaker thinks that he/she is not the type of people who would save money by taking advantage of public resources.,expressives,uncertain,IMP,NAG,
adultery,9/7/2024 22:28,lm0b2f5,sayyestothemess123,"I mean, everyone loves a deal. But yeah, the discount wouldn’t be worth my lack of peace of mind.",lm0ankz,"{""content"":""The speaker thinks that some deals may compromise one's peace of mind."", ""type"":""representatives""}",The speaker thinks that some deals may compromise one's peace of mind.,representatives,uncertain,PRE,NAG,
adultery,9/7/2024 22:45,lm0dzyz,Human-Click225,I can tell you with confidence the Intercontinetal London Park Lane will give you a call at 10:01 if you’ve not checked out.,1fbf610,"{""content"":""It is impossible to overrun the checkout deadline."", ""type"":""representatives""}",It is impossible to overrun the checkout deadline.,representatives,yes,IMP,NAG,
adultery,9/7/2024 22:48,lm0eisk,beautifufbitch780,"you can try...if they knock to your door you can always blame them...their mistake, as you are sure you booked all night 😊😊

let's be shifty cheaters 😅",lm0a180,"{""content"":""There are some ways to get away with not booking the whole night."", ""type"":""representatives""},{""content"":""Not booking the whole night but pretending so would make one a shifty cheater."", ""type"":""directives""}",There are some ways to get away with not booking the whole night.,representatives,no,IMP,CAG,"critical of some behavior, ironic"
adultery,9/8/2024 4:26,lm1wjdo,piriform1s,"I kinda just leave my dayuses without checking out tho, never had issues like this. Should I stop?",lm0dzyz,"{""content"": ""The OP thinks that if he/she does not check out, it is potentially risky because he/she will be called, based on the hearer's information."", ""type"":""representatives""},{""content"":""The OP might imply that he/she has never overrun the checkout deadline."", ""type"":""representatives""}","The OP thinks that if he/she does not check out, it is potentially risky because he/she will be called, based on the hearer's information.",representatives,yes,IMP,NAG,
adultery,9/8/2024 4:27,lm1wpgb,piriform1s,"I mean cheating is already shifty, I don't quite get this highground you're trying to make.",lm0eisk,"{""content"":""The OP thinks that the hearer is critical of pretending to have booked for the whole night and calling this behavior 'shifty' with an air of superiority."", ""type"":""expressives""}",The OP thinks that the hearer is critical of pretending to have booked for the whole night and calling this behavior 'shifty' with an air of superiority.,expressives,no,IMP,CAG,"""highground"""
adultery,9/8/2024 4:40,lm1yjhx,Human-Click225,"It says in the FAQ you must vacate room by end of your time slot. 

You would possibly be making it laborious for teams to sort out if you’ve gone or not. You’re meant to make it known you’ve left on time. It’s part of the ToS on their site.",lm1wjdo,"{""content"":""If a customer just leaves without checking out, it adds work to the teams so that they have to check the room."", ""type"":""representatives""},{""content"":""The speaker thinks that the rules are written terms of service, and the customers should follow the rules."", ""type"":"" directives""}","The speaker thinks that the rules are written terms of service, and the customers should follow the rules.",directives,uncertain,IMP,NAG,
adultery,9/8/2024 6:42,lm2eoyr,beautifufbitch780,wooow #humour#..it was a joke....sometimes laughing helps.....,lm1wpgb,"{""content"":""The speaker thinks the OP overanalysed the message."", ""type"":""representatives""}",The speaker thinks the OP overanalysed the message.,representatives,yes,IMP,NAG,
adultery,9/8/2024 12:39,lm3d1nk,piriform1s,"Sorry, didn't pick it up!",lm2eoyr,literal,,,uncertain,,NAG,
