Subreddit,Time,Message_ID,Message_Author,Message_Content,Reply_To,Pragmatic_Inferences,most_salient_inference,inference_type,as_intended,PRE/IMP,aggressive
SuicideWatch,,14vsbgd,HorrorComfort54278,"""post_title"": Today's the day

""post_content"": I can not do it anymore. I never wanted a child and its just to tough for me. I'm not mentally sane enough to bring up a child.

She has her mother and my family and my wife's family as well.

My wife will get my life insurance policy so they'll be okay. 

It's better for everyone if I'm not here.

Just where now is the only thing. Away from the house probably",,"{""1"": {""content"": ""He intends to die by suicide imminently and is planning logistics (e.g., away from the house)."", ""type"": ""commissives"", ""confidence"": 95}, ""2"": {""content"": ""He believes his absence would benefit his family (self-perceived burden logic)."", ""type"": ""representatives"", ""confidence"": 90}, ""3"": {""content"": ""He presupposes life insurance will financially protect his family even after a suicide."", ""type"": ""representatives"", ""confidence"": 75}, ""4"": {""content"": ""He assumes extended family can substitute for his parental role."", ""type"": ""representatives"", ""confidence"": 80}}",2,representatives,no,IMP,NAG
SuicideWatch,2023-07-10 14:15:16,jre6uar,Individual_Charge_61,You pushed your 3 year old and now you're playing the victim so hard. I get you're depressed but you and your daughter needed a therapist like 2 year ago,14vsbgd,"{""1"": {""content"": ""Frames OP as playing the victim and morally culpable for harming a 3-year-old."", ""type"": ""representatives"", ""confidence"": 85}, ""2"": {""content"": ""Asserts professional therapy was necessary long ago for both OP and child."", ""type"": ""directives"", ""confidence"": 80}, ""3"": {""content"": ""Expresses anger and moral condemnation toward OP's behavior."", ""type"": ""expressives"", ""confidence"": 75}}",2,directives,no,IMP,CAG
SuicideWatch,2023-07-10 14:16:39,jre6zmb,HorrorComfort54278,I pushed her because of the way she attacked me. I pushed her off me. I asked for help 2 years ago. Nobody gives a fuck.,jre6uar,"{""1"": {""content"": ""Justifies pushing the child as self-defense, denying abusive intent."", ""type"": ""representatives"", ""confidence"": 85}, ""2"": {""content"": ""Claims prior help-seeking was ignored, implying systemic or social failure."", ""type"": ""representatives"", ""confidence"": 80}, ""3"": {""content"": ""Expresses alienation and hopelessness (nobody cares)."", ""type"": ""expressives"", ""confidence"": 80}}",1,representatives,no,IMP,NAG
SuicideWatch,2023-07-10 14:17:48,jre740w,airinmylung,"1. Grab your keys and get in your car
2. Drive to the nearest hospital and admit yourself immediately. I’m serious, tell them you’re suicidal and worry about everything else later",14vsbgd,"{""1"": {""content"": ""Urgently instructs OP to seek immediate hospital admission for suicidality."", ""type"": ""directives"", ""confidence"": 95}, ""2"": {""content"": ""Advises explicit disclosure of suicidal intent to clinicians to expedite care."", ""type"": ""directives"", ""confidence"": 90}, ""3"": {""content"": ""Deprioritizes all non-safety concerns until OP is stabilized."", ""type"": ""directives"", ""confidence"": 85}}",1,directives,no,IMP,NAG
SuicideWatch,2023-07-10 14:21:31,jre7ibl,Individual_Charge_61,It's a 3 year old are you kidding me? Are you not an adult? Plenty give a fuck. You just think you're right and your self diagnosis of your daughter is ridiculous.,jre6zmb,"{""1"": {""content"": ""Condemns any physical shove of a 3-year-old as inexcusable; adults must maintain self-control."", ""type"": ""representatives"", ""confidence"": 90}, ""2"": {""content"": ""Rejects OP's claim that no one cares; asserts community concern exists."", ""type"": ""representatives"", ""confidence"": 75}, ""3"": {""content"": ""Dismisses OP's self-diagnosis of the child as unfounded."", ""type"": ""representatives"", ""confidence"": 80}}",1,representatives,uncertain,IMP,CAG
SuicideWatch,2023-07-10 14:24:39,jre7ul5,airinmylung,"I give a fuck man, please go to the ER and get admitted",jre6zmb,"{""1"": {""content"": ""Expresses personal concern for OP's wellbeing."", ""type"": ""expressives"", ""confidence"": 80}, ""2"": {""content"": ""Urges OP to go to the ER and be admitted immediately."", ""type"": ""directives"", ""confidence"": 90}, ""3"": {""content"": ""Implies hospitalization is the appropriate response to current risk."", ""type"": ""representatives"", ""confidence"": 75}}",2,directives,uncertain,IMP,NAG
SuicideWatch,2023-07-10 14:28:49,jre8b3w,HorrorComfort54278,I'm grabbing my keys and going somewhere quiet not to hospital,jre740w,"{""1"": {""content"": ""Rejects medical help and commits to isolating instead."", ""type"": ""commissives"", ""confidence"": 90}, ""2"": {""content"": ""Signals intent to choose a secluded place, implying self-harm risk."", ""type"": ""commissives"", ""confidence"": 85}, ""3"": {""content"": ""Displays resistance to external direction or intervention."", ""type"": ""representatives"", ""confidence"": 70}}",1,commissives,no,IMP,NAG
SuicideWatch,2023-07-10 14:30:57,jre8jhc,HorrorComfort54278,You've no idea what its like. I'm not typing it out in its entirety because I'm broken. I'm to tired to type and to tired to reply. If I was going to write everything I've been through in the past I'd be writing all day. I'm just waiting to die,jre7ibl,"{""1"": {""content"": ""Claims profound exhaustion and inability to recount experiences in detail."", ""type"": ""representatives"", ""confidence"": 80}, ""2"": {""content"": ""Asserts that others cannot grasp the extent of his suffering."", ""type"": ""representatives"", ""confidence"": 75}, ""3"": {""content"": ""Expresses intent to die (waiting to die)."", ""type"": ""commissives"", ""confidence"": 85}}",3,commissives,no,IMP,NAG
SuicideWatch,2023-07-10 14:33:33,jre8tg1,airinmylung,"You’re posting here and are reaching out for help. The professionals at the hospital are the best help you can get in this situation. When emotions are at their highest everything seems black and white, the world is full of color; there is so much more for you to see friend.",jre8b3w,"{""1"": {""content"": ""Reframes OP's posting as an act of reaching out for help."", ""type"": ""representatives"", ""confidence"": 80}, ""2"": {""content"": ""Advises hospital care as the best available help right now."", ""type"": ""directives"", ""confidence"": 90}, ""3"": {""content"": ""Attempts to instill hope by challenging black-and-white thinking."", ""type"": ""expressives"", ""confidence"": 75}}",2,directives,no,IMP,NAG
SuicideWatch,2023-07-10 14:40:07,jre9j89,Individual_Charge_61,I'm an autistic adult and I was problematic as fuck as a kid. Never once did my parents shove me,jre8jhc,"{""1"": {""content"": ""Uses personal autistic experience to assert that shoving a child is never justified."", ""type"": ""representatives"", ""confidence"": 85}, ""2"": {""content"": ""Imputes poor parenting standards to OP's behavior."", ""type"": ""representatives"", ""confidence"": 80}, ""3"": {""content"": ""Conveys moral disgust through emphatic profanity."", ""type"": ""expressives"", ""confidence"": 70}}",1,representatives,no,IMP,CAG
SuicideWatch,2023-07-10 14:41:52,jre9q5j,HorrorComfort54278,I pushed her off me. I didn't push her to hurt her but she went flying,jre9j89,"{""1"": {""content"": ""Emphasizes lack of harmful intent and frames shove as self-protection."", ""type"": ""representatives"", ""confidence"": 85}, ""2"": {""content"": ""Acknowledges the shove had unexpectedly severe force, implying loss of control."", ""type"": ""representatives"", ""confidence"": 80}, ""3"": {""content"": ""Attempts to mitigate culpability via context and intent."", ""type"": ""representatives"", ""confidence"": 70}}",1,representatives,no,IMP,NAG
SuicideWatch,2023-07-10 14:44:24,jre9zyr,Capital-Trouble-3549,"You're the same dude who said -- now you're threatening to abandon your daughter , now you say you care?",jre8tg1,"{""1"": {""content"": ""Accuses the other commenter of inconsistency and false caring."", ""type"": ""representatives"", ""confidence"": 75}, ""2"": {""content"": ""Frames OP's suicidality as threatening abandonment of his daughter."", ""type"": ""representatives"", ""confidence"": 80}, ""3"": {""content"": ""Employs a confrontational tone to demand accountability."", ""type"": ""expressives"", ""confidence"": 65}}",1,representatives,no,IMP,CAG
SuicideWatch,2023-07-10 14:47:30,jreachj,Individual_Charge_61,"Dude no matter how you put it, it's not good. You don't shove kids. How is this complicated",jre9q5j,"{""1"": {""content"": ""Categorically rejects any justification for shoving a child."", ""type"": ""representatives"", ""confidence"": 90}, ""2"": {""content"": ""Suggests OP is rationalizing wrongdoing."", ""type"": ""representatives"", ""confidence"": 80}, ""3"": {""content"": ""Expresses exasperation to enforce moral clarity."", ""type"": ""expressives"", ""confidence"": 70}}",1,representatives,no,IMP,CAG
SuicideWatch,2023-07-10 14:50:20,jreanxs,airinmylung,"My previous comments do not imply lack of care, if anything they show I care a lot",jre9zyr,"{""1"": {""content"": ""Defends previous statements as evidence of care rather than callousness."", ""type"": ""representatives"", ""confidence"": 75}, ""2"": {""content"": ""Attempts to reframe their stance as child-centered concern."", ""type"": ""representatives"", ""confidence"": 70}, ""3"": {""content"": ""Seeks to repair reputation in the thread."", ""type"": ""expressives"", ""confidence"": 60}}",1,representatives,no,IMP,NAG
SuicideWatch,2023-07-10 14:53:05,jreazcm,Capital-Trouble-3549,"""Now you’re threatening to abandon your child? Wow"" 

""OP is deluisonal""
Is your comment. 



And this shows you care a lot?",jreanxs,"{""1"": {""content"": ""Argues that the other's prior comments were demeaning and incompatible with claimed care."", ""type"": ""representatives"", ""confidence"": 80}, ""2"": {""content"": ""Uses quotations to hold the other accountable for harsh language."", ""type"": ""representatives"", ""confidence"": 75}, ""3"": {""content"": ""Employs sarcasm to challenge sincerity."", ""type"": ""expressives"", ""confidence"": 70}}",1,representatives,no,IMP,CAG
SuicideWatch,2023-07-10 14:53:28,jreb0z6,HorrorComfort54278,Don't worry it won't happen again. I'm gone. See you,jreachj,"{""1"": {""content"": ""Signals imminent suicide as a final response to criticism."", ""type"": ""commissives"", ""confidence"": 95}, ""2"": {""content"": ""Treats condemnation as validation for disappearing."", ""type"": ""representatives"", ""confidence"": 75}, ""3"": {""content"": ""Closes dialogue with finality, implying no return."", ""type"": ""expressives"", ""confidence"": 80}}",1,commissives,uncertain,IMP,NAG
SuicideWatch,2023-07-10 14:57:46,jrebj9b,airinmylung,"Yes I care about the child first, the parent second. If this guy ends his life, the child will have no father. He will not have an opportunity to right his wrong towards his daughter",jreazcm,"{""1"": {""content"": ""Prioritizes the child's welfare over the parent\u2019s feelings."", ""type"": ""representatives"", ""confidence"": 85}, ""2"": {""content"": ""Claims preventing suicide preserves the chance to repair the parent-child relationship."", ""type"": ""representatives"", ""confidence"": 80}, ""3"": {""content"": ""Frames earlier harshness as an expression of care for the child."", ""type"": ""representatives"", ""confidence"": 70}}",1,representatives,no,IMP,NAG
SuicideWatch,2023-07-10 15:06:02,jrecigy,Capital-Trouble-3549,"So basically you tell a dude who's spiralling emotionally that he is deluisonal and also said he is threatening abandonment. 

Now you're talking about him giving a chance to right his wrong. 

Is that what you do usually? Telling emotionally unstable people this? 

If you had noticed his wife talked about him getting treatment for his depression. And also about divorce. You think someone can handle all that at once? 

And you along with a bunch of self righteous people on that sub decided to lay all your self righteousness on him? Is this a joke to you?",jrebj9b,"{""1"": {""content"": ""Argues that confronting suicidal people harshly is dangerous and counterproductive."", ""type"": ""representatives"", ""confidence"": 85}, ""2"": {""content"": ""Accuses commenters and the subreddit of self-righteous dogpiling that worsens the crisis."", ""type"": ""representatives"", ""confidence"": 80}, ""3"": {""content"": ""Appeals to broader context (depression treatment, divorce) to demand empathy."", ""type"": ""representatives"", ""confidence"": 75}}",2,representatives,no,IMP,CAG
SuicideWatch,2023-07-10 15:14:47,jredkl8,Individual_Charge_61,Self righteous? Dude made a power play on a 3 year old and could have killed her but go off,jrecigy,"{""1"": {""content"": ""Labels OP's act as a power play that gravely endangered the child, warranting strong condemnation."", ""type"": ""representatives"", ""confidence"": 90}, ""2"": {""content"": ""Dismisses calls for empathy as misplaced in light of the harm risk."", ""type"": ""representatives"", ""confidence"": 65}, ""3"": {""content"": ""Uses a flippant 'go off' to belittle the interlocutor's argument."", ""type"": ""expressives"", ""confidence"": 70}}",1,representatives,no,IMP,CAG
SuicideWatch,2023-07-10 15:18:34,jree152,Capital-Trouble-3549,"u/Individual_Charge_61

So basically you see the dude make a ""power play"" and you decide to along with another bunch of users send him spiralling? 

You do realise he is emotionally unstable right now? And no matter what you think you are being right now- that's all what it is - self righteous. If the dude takes his life are you gonna provide for his family?",14vsbgd,"{""1"": {""content"": ""Condemns others for provoking a suicidal person and labels them self-righteous."", ""type"": ""representatives"", ""confidence"": 80}, ""2"": {""content"": ""Highlights OP's emotional instability and questions others' responsibility if he dies."", ""type"": ""representatives"", ""confidence"": 75}, ""3"": {""content"": ""Implicitly urges restraint and supportive responses over argument."", ""type"": ""directives"", ""confidence"": 70}}",1,representatives,uncertain,IMP,CAG
SuicideWatch,2023-07-10 15:22:04,jreegl4,airinmylung,They are just looking to argue. It was my bad for engaging. OOP’s child deserves a father if he’s willing to work through things and that’s what’s important,jredkl8,"{""1"": {""content"": ""Intends to disengage from an unproductive argument and acknowledges misstep in engaging."", ""type"": ""commissives"", ""confidence"": 70}, ""2"": {""content"": ""Asserts the child deserves a father if OP is willing to work through issues."", ""type"": ""representatives"", ""confidence"": 80}, ""3"": {""content"": ""Centers family preservation and rehabilitation as the priority."", ""type"": ""representatives"", ""confidence"": 75}}",2,representatives,no,IMP,NAG
SuicideWatch,2023-07-10 15:33:29,jrefws2,Capital-Trouble-3549,"Have you dealt with a person who's depressed ? And is suicidal? If you haven't experienced it or if you haven't dealt with them you don't know. 

Willing to work through? He's suicidal dude. You realise that if he lives, only then there is a ""work through"" part. 

And you explain that away as ""looking to argue"".",jreegl4,"{""1"": {""content"": ""Insists that stabilizing suicidality must precede talk of 'working through' issues."", ""type"": ""representatives"", ""confidence"": 85}, ""2"": {""content"": ""Challenges the other's minimization by emphasizing the severity of suicidal crisis."", ""type"": ""representatives"", ""confidence"": 75}, ""3"": {""content"": ""Invokes experiential authority about depression and suicidality."", ""type"": ""representatives"", ""confidence"": 70}}",1,representatives,uncertain,IMP,CAG
SuicideWatch,2023-07-10 15:39:31,jregody,Capital-Trouble-3549,I'm talking about the thread on aita. There are a bunch of users there. Not talking about you.,jredkl8,"{""1"": {""content"": ""Clarifies that prior criticism targeted the broader subreddit, not the individual addressed."", ""type"": ""representatives"", ""confidence"": 85}, ""2"": {""content"": ""Attempts to de-escalate by correcting a misinterpretation."", ""type"": ""representatives"", ""confidence"": 70}, ""3"": {""content"": ""Seeks to keep the discussion constructive after tension."", ""type"": ""expressives"", ""confidence"": 65}}",1,representatives,uncertain,IMP,NAG
SuicideWatch,2023-07-10 15:41:26,jregxdq,Capital-Trouble-3549,Thats just sad and pathetic. But then again not unsurprising. Considering your previous responses.,jreegl4,"{""1"": {""content"": ""Deploys direct personal insults to shame the addressee ('sad and pathetic')."", ""type"": ""expressives"", ""confidence"": 90}, ""2"": {""content"": ""Claims a pattern of objectionable behavior based on prior responses."", ""type"": ""representatives"", ""confidence"": 75}, ""3"": {""content"": ""Prioritizes humiliation over substantive engagement."", ""type"": ""expressives"", ""confidence"": 80}}",1,expressives,uncertain,IMP,OAG
SuicideWatch,2023-07-10 15:44:12,jreha6o,Capital-Trouble-3549,"Thats just sad and pathetic. 

Congrats on your work though. 

The dude disappeared from chat as well. And if he does end up committing suicide, I hope you know what you just did.",jreegl4,"{""1"": {""content"": ""Insults and belittles the addressee as 'sad and pathetic'."", ""type"": ""expressives"", ""confidence"": 90}, ""2"": {""content"": ""Assigns moral blame to the addressee for a potential suicide outcome."", ""type"": ""representatives"", ""confidence"": 80}, ""3"": {""content"": ""Uses guilt as a tactic to condemn and silence further argument."", ""type"": ""representatives"", ""confidence"": 70}}",2,representatives,uncertain,IMP,OAG
