Subreddit,Time,Message_ID,Message_Author,Message_Content,Reply_To,Pragmatic_Inferences,most_salient_inference,inference_type,as_intended,PRE/IMP,aggressive
FuckingFascists,,1auzij4,Mialas_,"""post_title"": (F26) I’m a feminist slut who fucking hated fascism. 

""post_content"": Let’s be honest I love my life fine without man there useless unnecessary only reason we use you is for cum and some of you can’t even do that fucking pathetic. WOMEN DONT NEED MEN!!!",,"{""1"": {""content"": ""Positions men as unnecessary and merely instrumental (for semen), asserting women\u2019s self-sufficiency."", ""type"": ""representatives"", ""confidence"": 95}, ""2"": {""content"": ""Self-identifies with sex-positive feminism and anti-fascism as core identity markers."", ""type"": ""expressives"", ""confidence"": 80}, ""3"": {""content"": ""Uses intentionally inflammatory language to provoke and antagonize men."", ""type"": ""expressives"", ""confidence"": 82}}",1,representatives,no,IMP,OAG
FuckingFascists,2024-02-19 22:44:07,kr7705w,Exposurebitches,"You say that now but when someone insults and degrades you, you fall to your knees begging to be made into a proper slut desperate to be denied orgasm and make into a dumb bitch who's only purpose in life is to be a mans cumdump",1auzij4,"{""1"": {""content"": ""Assumes women\u2019s declarations of independence mask a desire for male domination and humiliation."", ""type"": ""representatives"", ""confidence"": 90}, ""2"": {""content"": ""Threatens sexual denial/degradation as a means of control."", ""type"": ""commissives"", ""confidence"": 85}, ""3"": {""content"": ""Frames a woman\u2019s 'proper' role as a submissive receptacle for men."", ""type"": ""representatives"", ""confidence"": 88}}",1,representatives,no,IMP,OAG
FuckingFascists,2024-02-19 22:44:45,kr774gj,GonnaMakeYouWorse,I bet you’re the kind of stupid girl that says this kind of shit but then when she’s ovulating dreams about getting bred and becoming a traditional wife for someone,1auzij4,"{""1"": {""content"": ""Claims female biology (ovulation) dictates desire for breeding and a 'traditional wife' role."", ""type"": ""representatives"", ""confidence"": 92}, ""2"": {""content"": ""Accuses the speaker of hypocrisy and performative rhetoric."", ""type"": ""representatives"", ""confidence"": 80}, ""3"": {""content"": ""Insults to assert intellectual/moral superiority over the woman."", ""type"": ""expressives"", ""confidence"": 85}}",1,representatives,no,IMP,OAG
FuckingFascists,2024-02-19 22:45:01,kr7761w,Mialas_,I don’t need a man,kr7705w,"{""1"": {""content"": ""Reasserts independence and rejects male sexual/romantic authority."", ""type"": ""representatives"", ""confidence"": 90}, ""2"": {""content"": ""Refuses coercion and degradation."", ""type"": ""commissives"", ""confidence"": 70}, ""3"": {""content"": ""Signals confidence and self-sufficiency."", ""type"": ""expressives"", ""confidence"": 75}}",1,representatives,no,IMP,NAG
FuckingFascists,2024-02-19 22:45:36,kr779wn,Mialas_,Don’t have periods or ovulate,kr774gj,"{""1"": {""content"": ""Claims lack of menstruation/ovulation (e.g., medical or chosen suppression)."", ""type"": ""representatives"", ""confidence"": 85}, ""2"": {""content"": ""Counters the idea that hormones drive her choices or desires."", ""type"": ""representatives"", ""confidence"": 88}, ""3"": {""content"": ""Asserts bodily autonomy independent of reproductive cycles."", ""type"": ""representatives"", ""confidence"": 70}}",1,representatives,yes,IMP,NAG
FuckingFascists,2024-02-19 22:46:47,kr77hk7,GonnaMakeYouWorse,Why? Something about your body broken? Such a shame that you’ll never get to fulfill your true value. I kind of feel bad for you.,kr779wn,"{""1"": {""content"": ""Equates women\u2019s 'true value' with fertility; infertility implies brokenness."", ""type"": ""representatives"", ""confidence"": 90}, ""2"": {""content"": ""Deploys condescending pity as a shaming tactic."", ""type"": ""expressives"", ""confidence"": 80}, ""3"": {""content"": ""Polices female worth through a pronatalist ideology."", ""type"": ""representatives"", ""confidence"": 78}}",1,representatives,no,IMP,OAG
FuckingFascists,2024-02-19 22:48:12,kr77r2l,Mialas_,No I’m fine without means I don’t have my body changing all the time,kr77hk7,"{""1"": {""content"": ""Reframes lack of cycles as a deliberate, beneficial choice."", ""type"": ""representatives"", ""confidence"": 80}, ""2"": {""content"": ""Rejects pronatalist value judgments by prioritizing bodily stability over fertility."", ""type"": ""representatives"", ""confidence"": 78}, ""3"": {""content"": ""Indicates no desire for pregnancy-related bodily changes."", ""type"": ""representatives"", ""confidence"": 75}}",2,representatives,no,IMP,NAG
FuckingFascists,2024-02-19 22:49:59,kr782sa,GonnaMakeYouWorse,"I don’t you ever feel the desire to have children? Do you lament to the fact that you’ll never get to experience motherhood? Don’t even talk about adopting, or any stupid stuff like that, you know it’s not the same",kr77r2l,"{""1"": {""content"": ""Assumes women naturally desire biological motherhood."", ""type"": ""representatives"", ""confidence"": 92}, ""2"": {""content"": ""Devalues adoption as inferior to biological reproduction."", ""type"": ""representatives"", ""confidence"": 90}, ""3"": {""content"": ""Attempts to pressure by framing childfree life as lamentable."", ""type"": ""directives"", ""confidence"": 70}}",1,representatives,no,IMP,CAG
FuckingFascists,2024-02-19 22:50:01,kr7830r,Wild-Homework3210,Yet here you are begging for dick,1auzij4,"{""1"": {""content"": ""Accuses the speaker of hypocrisy: misandry masks a desire for sex with men."", ""type"": ""representatives"", ""confidence"": 90}, ""2"": {""content"": ""Uses sexual shaming to undermine credibility."", ""type"": ""expressives"", ""confidence"": 85}, ""3"": {""content"": ""Provokes by implying desperation for male attention."", ""type"": ""expressives"", ""confidence"": 75}}",1,representatives,no,IMP,OAG
FuckingFascists,2024-02-19 22:50:26,kr785uw,Mialas_,Do I look like I want duck,kr7830r,"{""1"": {""content"": ""Denies sexual interest and challenges the accuser\u2019s claim."", ""type"": ""representatives"", ""confidence"": 85}, ""2"": {""content"": ""Uses sarcasm/typo humor to belittle the accusation."", ""type"": ""expressives"", ""confidence"": 75}, ""3"": {""content"": ""Reasserts agency over her desire narrative."", ""type"": ""representatives"", ""confidence"": 70}}",1,representatives,no,IMP,NAG
FuckingFascists,2024-02-19 22:50:52,kr788nu,Wild-Homework3210,"Duck no, dick yes",kr785uw,"{""1"": {""content"": ""Dismisses her denial and claims she does want sex with men."", ""type"": ""representatives"", ""confidence"": 88}, ""2"": {""content"": ""Continues sexual harassment through mocking wordplay."", ""type"": ""expressives"", ""confidence"": 85}, ""3"": {""content"": ""Asserts male entitlement to define a woman\u2019s desires."", ""type"": ""representatives"", ""confidence"": 80}}",1,representatives,no,IMP,OAG
FuckingFascists,2024-02-19 22:51:08,kr78ahp,Mialas_,I don’t want kids turn out like you or some pussy I don’t need that,kr782sa,"{""1"": {""content"": ""Rejects motherhood, linking the choice to disdain for the replier\u2019s values."", ""type"": ""representatives"", ""confidence"": 85}, ""2"": {""content"": ""Uses insult to invert and repel the shaming attempt."", ""type"": ""expressives"", ""confidence"": 80}, ""3"": {""content"": ""Frames being childfree as preferable to raising offspring like the interlocutor."", ""type"": ""representatives"", ""confidence"": 78}}",1,representatives,yes,IMP,OAG
FuckingFascists,2024-02-19 22:51:23,kr78c5f,Mialas_,I don’t need dick,kr788nu,"{""1"": {""content"": ""Asserts sexual autonomy by denying any need for male sexual gratification."", ""type"": ""representatives"", ""confidence"": 90}, ""2"": {""content"": ""Refuses further harassment by setting a clear boundary."", ""type"": ""commissives"", ""confidence"": 75}, ""3"": {""content"": ""Counters the stereotype that women inherently crave men."", ""type"": ""representatives"", ""confidence"": 80}}",1,representatives,no,IMP,NAG
FuckingFascists,2024-02-19 22:51:54,kr78fnt,Wild-Homework3210,"Yes you do, your pussy is aching for it",kr78c5f,"{""1"": {""content"": ""Claims to know her desires better than she does, overriding her self-report."", ""type"": ""representatives"", ""confidence"": 88}, ""2"": {""content"": ""Displays sexual aggression by asserting she is craving men."", ""type"": ""expressives"", ""confidence"": 85}, ""3"": {""content"": ""Attempts to erode her agency through persistent contradiction."", ""type"": ""representatives"", ""confidence"": 78}}",1,representatives,uncertain,IMP,OAG
FuckingFascists,2024-02-19 22:52:39,kr78kmv,Exposurebitches,Sure darling just get on your knees and learn to be quiet,kr7761w,"{""1"": {""content"": ""Issues a demeaning command to kneel and be silent, asserting dominance."", ""type"": ""directives"", ""confidence"": 95}, ""2"": {""content"": ""Expresses belief that women should be submissive to men."", ""type"": ""representatives"", ""confidence"": 88}, ""3"": {""content"": ""Uses patronizing address to belittle the target."", ""type"": ""expressives"", ""confidence"": 75}}",1,directives,uncertain,IMP,OAG
FuckingFascists,2024-02-19 22:52:49,kr78lrf,GonnaMakeYouWorse,"Oh, those are pretty harsh words, given the fact I was simply asking a question. If that’s how you talk to men, nobody is going to want you anyway so I guess it’s not a problem.",kr78ahp,"{""1"": {""content"": ""Tone-polices to delegitimize her stance by labeling it 'harsh.'"", ""type"": ""representatives"", ""confidence"": 80}, ""2"": {""content"": ""Posits men\u2019s approval/desire as a key metric of a woman\u2019s value."", ""type"": ""representatives"", ""confidence"": 88}, ""3"": {""content"": ""Predicts social/romantic isolation as a consequence, implying a warning."", ""type"": ""representatives"", ""confidence"": 78}}",2,representatives,no,IMP,CAG
FuckingFascists,2024-02-19 22:53:40,kr78rd8,One_PercentofMyPower,"Looool. You think You deserve My Holy, Godly, life-giving Semen, hole?

At best I might bless you with a warm Golden Shower of My Urine. And for even that you gotta work. A LOT.",1auzij4,"{""1"": {""content"": ""Promotes a dehumanizing dominance fantasy elevating male bodily fluids as 'divine.'"", ""type"": ""representatives"", ""confidence"": 85}, ""2"": {""content"": ""Makes a conditional degrading 'offer,' implying power over the target."", ""type"": ""commissives"", ""confidence"": 90}, ""3"": {""content"": ""Displays contempt with the aim to humiliate and punish."", ""type"": ""expressives"", ""confidence"": 88}}",2,commissives,no,IMP,OAG
FuckingFascists,2024-02-19 22:54:19,kr78vsd,Mialas_,God your cum isn’t godly probably barley passes as the real thing,kr78rd8,"{""1"": {""content"": ""Ridicules his grandiose claims by questioning his sexual prowess."", ""type"": ""representatives"", ""confidence"": 80}, ""2"": {""content"": ""Uses mockery to resist his attempted dominance."", ""type"": ""expressives"", ""confidence"": 78}, ""3"": {""content"": ""Challenges his masculinity/status through derision."", ""type"": ""expressives"", ""confidence"": 75}}",1,representatives,no,IMP,CAG
FuckingFascists,2024-02-19 22:54:45,kr78yl5,Mialas_,Yeah it’s not a problem men are useless,kr78lrf,"{""1"": {""content"": ""Reaffirms that men\u2019s approval/participation is unnecessary and men are 'useless.'"", ""type"": ""representatives"", ""confidence"": 90}, ""2"": {""content"": ""Accepts being unwanted by men as inconsequential."", ""type"": ""representatives"", ""confidence"": 85}, ""3"": {""content"": ""Continues provocative generalization to antagonize male critics."", ""type"": ""expressives"", ""confidence"": 80}}",2,representatives,no,IMP,OAG
FuckingFascists,2024-02-19 22:56:22,kr7994s,One_PercentofMyPower,"I mean, infront of a walking womb(at best; you are probably not even that) Even My piss is Divine.

I will shoot a stream of it straight into your eyes, If you do a good enough job licking My hairy Man ass clean.",kr78vsd,"{""1"": {""content"": ""Reduces women to 'walking wombs,' expressing misogynistic essentialism."", ""type"": ""representatives"", ""confidence"": 92}, ""2"": {""content"": ""Promises a degrading act contingent on obedience, as a display of power."", ""type"": ""commissives"", ""confidence"": 95}, ""3"": {""content"": ""Signals intent to humiliate through violent, demeaning imagery."", ""type"": ""expressives"", ""confidence"": 88}}",2,commissives,uncertain,IMP,OAG
FuckingFascists,2024-02-19 22:56:42,kr79bah,GonnaMakeYouWorse,Sounds like either your choices are to become a Dyke or get a bunch of cats and die alone.,kr78yl5,"{""1"": {""content"": ""Uses a homophobic slur to shame independence by equating lesbianism with failure."", ""type"": ""expressives"", ""confidence"": 90}, ""2"": {""content"": ""Invokes the 'cat lady dying alone' stereotype to threaten social isolation."", ""type"": ""representatives"", ""confidence"": 90}, ""3"": {""content"": ""Attempts to coerce conformity to heterosexual coupling via fear of loneliness."", ""type"": ""representatives"", ""confidence"": 75}}",2,representatives,uncertain,IMP,OAG
